{
  "id": "11111111-1111-1111-1111-111111111111",
  "workstreamId": "22222222-2222-2222-2222-222222222222",
  "workstreamSeq": 4,
  "sessionId": "33333333-3333-3333-3333-333333333333",
  "sessionSeq": 2,
  "direction": "client_to_agent",
  "rpcKind": "request",
  "method": "session/prompt",
  "rpcId": "req-2",
  "envelope": { "jsonrpc": "2.0", "id": "req-2", "method": "session/prompt", "params": {} },
  "commandId": "44444444-4444-4444-4444-444444444444",
  "causationEventId": null,
  "purpose": "user",
  "entityKind": null,
  "entityId": null,
  "transportObservationId": null,
  "ingestMode": "live",
  "observedAt": "2026-08-03T00:00:00Z"
}
